<?xml version="1.0" encoding="UTF-8"?>

<obrazac:saglasnost xmlns:xsi="http://www.w3.org/2001/XMLSchema-instance"
    xsi:schemaLocation="http://www.ftn.uns.ac.rs/obrazac-saglasnosti ../schemas/obrazac-saglasnosti.xsd"
    xmlns:obrazac = "http://www.ftn.uns.ac.rs/obrazac-saglasnosti"
    xmlns:zaj="http://www.ftn.uns.ac.rs/zajednicka">
    
    <obrazac:drzavljanstvo>
        <zaj:stranoDrzavljanstvo>BIH</zaj:stranoDrzavljanstvo>
        <zaj:brojPasosa>008490806</zaj:brojPasosa>
    </obrazac:drzavljanstvo>
    
    <obrazac:podaciPacijenta>
        <zaj:ime>Милош</zaj:ime>
        <zaj:prezime>Панић</zaj:prezime>
        <zaj:pol>Женско</zaj:pol>
        <zaj:datumRodjenja>1999-06-25</zaj:datumRodjenja>
        <obrazac:imeRoditelja>Мајка</obrazac:imeRoditelja>
        <obrazac:podaciMjesta>
            <obrazac:mjestoRodjenja>Зрењанин</obrazac:mjestoRodjenja>
            <obrazac:adresa>
                <obrazac:ulica>Сарајевска</obrazac:ulica>
                <obrazac:broj>14</obrazac:broj>
            </obrazac:adresa>
            <obrazac:mjestoNaselje>Аеродромско насеље</obrazac:mjestoNaselje>
            <obrazac:opstinaGrad>Зрењанин</obrazac:opstinaGrad>
        </obrazac:podaciMjesta>
        <obrazac:kontaktPodaci>
            <obrazac:fiksniTelefon>023154684</obrazac:fiksniTelefon>
            <obrazac:mobilniTelefon>0658919849</obrazac:mobilniTelefon>
            <obrazac:imejl>cppanic@yahoo.com</obrazac:imejl>
        </obrazac:kontaktPodaci>
        <obrazac:radniStatus>незапослен</obrazac:radniStatus>
        <obrazac:zanimanjeZaposlenog>друго</obrazac:zanimanjeZaposlenog>
        <obrazac:socijalnaZastita>
            <obrazac:nijeKorisnikSocijalnog/>
        </obrazac:socijalnaZastita>
        <obrazac:izjavaSaglasnosti>
            <obrazac:saglasan/>
            <obrazac:imeLijeka>Pfizer-BioNTech</obrazac:imeLijeka>
        </obrazac:izjavaSaglasnosti>
        <obrazac:datumSaglasnosti>2021-11-30</obrazac:datumSaglasnosti>
    </obrazac:podaciPacijenta>
    
    
    <obrazac:evidencijaVakcinacije>
        <obrazac:nazivUstanove>Дом здравља Нови Сад</obrazac:nazivUstanove>
        <obrazac:vakcinacijskiPunkt>123</obrazac:vakcinacijskiPunkt>
        <obrazac:podaciLjekara>
            <obrazac:ime>Предраг</obrazac:ime>
            <obrazac:prezime>Кон</obrazac:prezime>
            <obrazac:brojTelefona>0631561558</obrazac:brojTelefona>
        </obrazac:podaciLjekara>
        <obrazac:podaciVakcinacija>
            <obrazac:nazivVakcine>Pfizer-BioNTech</obrazac:nazivVakcine>
            <obrazac:datumDavanjaVakcine>2021-11-01</obrazac:datumDavanjaVakcine>
            <obrazac:nacinDavanjaVakcine>ИМ</obrazac:nacinDavanjaVakcine>
            <obrazac:ekstremitet>Лијева рука</obrazac:ekstremitet>
            <obrazac:serijaVakcine>1591118</obrazac:serijaVakcine>
            <obrazac:proizvodjac>BioNTech</obrazac:proizvodjac>
            <obrazac:nezeljenaReakcija>Алергија на чоколаду</obrazac:nezeljenaReakcija>
            
            <obrazac:nazivVakcine>Pfizer-BioNTech</obrazac:nazivVakcine>
            <obrazac:datumDavanjaVakcine>2021-11-22</obrazac:datumDavanjaVakcine>
            <obrazac:nacinDavanjaVakcine>ИМ</obrazac:nacinDavanjaVakcine>
            <obrazac:ekstremitet>Лијева рука</obrazac:ekstremitet>
            <obrazac:serijaVakcine>711455</obrazac:serijaVakcine>
            <obrazac:proizvodjac>BioNTech</obrazac:proizvodjac>
            <obrazac:nezeljenaReakcija>Температура након једења чварака</obrazac:nezeljenaReakcija>
        </obrazac:podaciVakcinacija>
    </obrazac:evidencijaVakcinacije>
</obrazac:saglasnost>
